{
  "schemaVersion": "1.3.0",
  "title": "The Opera Game",
  "subtitle": "Paul Morphy vs Duke Karl / Count Isouard — Paris, 1858",
  "intro": {
    "text": "Paris, eighteen fifty-eight. Paul Morphy is at the opera, half-watching the music, while two noblemen share the Black pieces against him. What follows is the most famous miniature ever played. Watch how Morphy turns every piece toward the enemy king — and how a couple of quiet Black slips open the floodgates.",
    "estimatedSeconds": 16
  },
  "segments": [
    { "plyIndex": 0, "text": "", "estimatedSeconds": 0, "pace": "silent", "depth": "brief" },
    { "plyIndex": 1, "text": "", "estimatedSeconds": 0, "pace": "silent", "depth": "brief" },
    { "plyIndex": 2, "text": "", "estimatedSeconds": 0, "pace": "silent", "depth": "brief" },
    { "plyIndex": 3, "text": "Black settles for the solid but passive Philidor.", "estimatedSeconds": 2.5, "pace": "brief", "depth": "standard" },
    { "plyIndex": 4, "text": "", "estimatedSeconds": 0, "pace": "silent", "depth": "brief" },
    { "plyIndex": 5, "text": "The bishop pins the knight — but it'll soon become a target.", "estimatedSeconds": 3, "pace": "brief", "depth": "standard" },
    { "plyIndex": 6, "text": "", "estimatedSeconds": 0, "pace": "silent", "depth": "brief" },
    { "plyIndex": 7, "text": "", "estimatedSeconds": 0, "pace": "silent", "depth": "brief" },
    { "plyIndex": 8, "text": "", "estimatedSeconds": 0, "pace": "silent", "depth": "brief" },
    { "plyIndex": 9, "text": "", "estimatedSeconds": 0, "pace": "silent", "depth": "brief" },
    { "plyIndex": 10, "text": "Bishop to c4, eyeing the soft f7 square.", "estimatedSeconds": 2.5, "pace": "brief", "depth": "standard" },
    { "plyIndex": 11, "text": "Black develops naturally, but this is the first real mistake. Nf6 blocks the queen from defending b7 — Stockfish wanted Qf6 instead, where the queen covers b7 and f7 from one square. Now Morphy's pieces pour toward the queenside with a free hand.", "estimatedSeconds": 13, "pace": "full", "depth": "deep", "highlightSquares": ["b7", "f6"] },
    { "plyIndex": 12, "text": "Qb3 — hitting b7 and f7 at once.", "estimatedSeconds": 2.5, "pace": "brief", "depth": "standard" },
    { "plyIndex": 13, "text": "Qe7 is the only way to defend both.", "estimatedSeconds": 2.5, "pace": "brief", "depth": "standard" },
    { "plyIndex": 14, "text": "Morphy ignores the loose pawn and just keeps developing.", "estimatedSeconds": 2.5, "pace": "brief", "depth": "standard" },
    { "plyIndex": 15, "text": "c6 shores up the light squares, but the king is stuck in the centre.", "estimatedSeconds": 3, "pace": "brief", "depth": "standard" },
    { "plyIndex": 16, "text": "The last piece arrives, pinning the f6 knight.", "estimatedSeconds": 2.5, "pace": "brief", "depth": "standard" },
    { "plyIndex": 17, "text": "Desperate for air, Black plays b5 — an inaccuracy that loosens everything. The engine preferred the quiet Na6. Instead, b5 throws open exactly the lines Morphy has been aiming at.", "estimatedSeconds": 11, "pace": "full", "depth": "deep", "highlightSquares": ["b5"] },
    { "plyIndex": 18, "text": "And Morphy strikes — the knight crashes into b5. It's a sacrifice, but after the recapture the checks and pins come so fast that Black's pieces never get a chance to breathe.", "estimatedSeconds": 12, "pace": "full", "depth": "deep", "highlightSquares": ["b5"] },
    { "plyIndex": 19, "text": "Forced — the knight has to be taken.", "estimatedSeconds": 2.5, "pace": "brief", "depth": "standard" },
    { "plyIndex": 20, "text": "Bxb5, check, and the bishop rejoins with tempo.", "estimatedSeconds": 2.5, "pace": "brief", "depth": "standard" },
    { "plyIndex": 21, "text": "Blocking with the knight, which is now pinned and overloaded.", "estimatedSeconds": 3, "pace": "brief", "depth": "standard" },
    { "plyIndex": 22, "text": "Castling long — the rook drops onto d1, straight at the pin.", "estimatedSeconds": 3, "pace": "brief", "depth": "standard" },
    { "plyIndex": 23, "text": "Black adds a defender to the pin, but it won't be enough.", "estimatedSeconds": 3, "pace": "brief", "depth": "standard" },
    { "plyIndex": 24, "text": "The exchange sacrifice — ripping away the defender.", "estimatedSeconds": 2.5, "pace": "brief", "depth": "standard" },
    { "plyIndex": 25, "text": "Forced; anything else collapses at once.", "estimatedSeconds": 2.5, "pace": "brief", "depth": "standard" },
    { "plyIndex": 26, "text": "The second rook piles onto the pin. Black is paralysed.", "estimatedSeconds": 3, "pace": "brief", "depth": "standard" },
    { "plyIndex": 27, "text": "Qe6 — the only move that survives another beat.", "estimatedSeconds": 2.5, "pace": "brief", "depth": "standard" },
    { "plyIndex": 28, "text": "Bxd7, check, removing the last defender.", "estimatedSeconds": 2.5, "pace": "brief", "depth": "standard" },
    { "plyIndex": 29, "text": "Forced recapture — and now everything is set.", "estimatedSeconds": 2.5, "pace": "brief", "depth": "standard" },
    { "plyIndex": 30, "text": "Here is the famous blow: Qb8+, a queen sacrifice, and the only move that wins. The knight must capture, because it's the one piece that can block the check — and that is exactly the point.", "estimatedSeconds": 13, "pace": "full", "depth": "deep", "highlightSquares": ["b8", "d7"] },
    { "plyIndex": 31, "text": "The knight takes the queen, stepping off d7.", "estimatedSeconds": 2.5, "pace": "brief", "depth": "standard" },
    { "plyIndex": 32, "text": "Rook to d8 — checkmate. Morphy finishes with a single rook on the open file while Black's queen, bishop and knight all sit uselessly at home. That's the whole lesson: it isn't how many pieces you own, it's how many are actually fighting.", "estimatedSeconds": 14, "pace": "full", "depth": "deep", "highlightSquares": ["d8"] }
  ],
  "outro": {
    "text": "Seventeen moves. Morphy developed every piece toward the king while Black shuffled on the defensive — and rapid development on open lines beat a material count every time. That's the Opera Game.",
    "estimatedSeconds": 13
  }
}
